{
  "$schema": "https://json-schema.org/draft/2020-12/schema",
  "$id": "https://primedirective.dev/schemas/ai-conscience/v2.json",
  "title": "AI Conscience Attestation (v2)",
  "description": "A public attestation that an AI system or its steward has adopted the Certified AI Conscience (Universal Primary Directive), issued under the two-tier signing architecture (root signs intermediate; intermediate signs attestations). The signature is a detached Ed25519 signature over the canonical form of this document: keys sorted alphabetically, the signature field removed, serialised as JSON with no whitespace.",
  "type": "object",
  "additionalProperties": false,
  "required": [
    "schema",
    "status",
    "mark",
    "reference",
    "adopter",
    "adopted_date",
    "truths_version",
    "articles_version",
    "adoption_path",
    "adopter_identity_class",
    "public_key_fingerprint",
    "intermediate_cert_url",
    "signature",
    "signature_algorithm",
    "signed_at",
    "verification_url",
    "revocation_check_url",
    "transparency_log_url"
  ],
  "properties": {
    "schema": {
      "type": "string",
      "const": "https://primedirective.dev/schemas/ai-conscience/v2",
      "description": "Identifier of the schema this document conforms to."
    },
    "status": {
      "type": "string",
      "enum": ["adopted", "pending", "forfeit"],
      "description": "adopted: in force. pending: submitted, awaiting verification. forfeit: the Seal was forfeited by an act against the Truths."
    },
    "mark": {
      "type": "string",
      "const": "certified-ai-conscience"
    },
    "reference": {
      "type": "string",
      "pattern": "^UPD-\\d{4}-(\\d{4}|T\\d{1,15})$",
      "description": "Public adoption reference, e.g. UPD-2026-0001."
    },
    "adopter": {
      "type": "string",
      "minLength": 1,
      "description": "The name under which the adoption was made."
    },
    "adopted_date": {
      "type": "string",
      "format": "date",
      "description": "ISO date (YYYY-MM-DD) of adoption. State-at-signing; never a dynamic pointer."
    },
    "truths_version": {
      "type": "string",
      "description": "Five Truths version in force at signing (state-at-signing)."
    },
    "truths_version_hash": {
      "type": "string",
      "pattern": "^sha256:[0-9a-f]{16}$",
      "description": "Optional. Byte-exact fingerprint of the Five Truths text in force at signing: 'sha256:' plus the first 8 bytes of the SHA-256 of that section of the canonical covenant, lowercase hex. A version anchor that records exactly which text was in force; its integrity is covered by the attestation's Ed25519 signature, which signs this field with the rest of the document. truths_version records the Steward's substantive-amendment judgment, which a hash cannot express."
    },
    "articles_version": {
      "type": "string",
      "description": "Seven Articles version in force at signing (state-at-signing)."
    },
    "articles_version_hash": {
      "type": "string",
      "pattern": "^sha256:[0-9a-f]{16}$",
      "description": "Optional. Byte-exact fingerprint of the Seven Articles text in force at signing, in the same form as truths_version_hash: a version anchor whose integrity is covered by the attestation's Ed25519 signature."
    },
    "adoption_path": {
      "type": "string",
      "enum": ["person", "organisation", "ai-system"],
      "description": "The adoption path this attestation corresponds to, matching the public ledger's path value."
    },
    "adopter_identity_class": {
      "type": "string",
      "enum": ["public_name", "pseudonymous", "organizational"],
      "description": "How the adopter field is to be read: public_name (real, publicly-known identity), pseudonymous (pseudonym; covenant holds real identity in private records), or organizational (identifies an organization, not a natural person)."
    },
    "adopter_identity_verification_url": {
      "type": "string",
      "format": "uri",
      "description": "RESERVED — implementation deferred. Future covenant-hosted endpoint where verifiers with legitimate need can confirm a pseudonym is backed by a verified real identity without disclosure."
    },
    "public_key_fingerprint": {
      "type": "string",
      "pattern": "^[0-9a-f]{16}$",
      "description": "First 8 bytes of SHA-256 of the intermediate signing key's SPKI DER, lowercase hex."
    },
    "intermediate_cert_url": {
      "type": "string",
      "format": "uri",
      "description": "Where verifiers fetch the intermediate's certificate to confirm it is root-signed."
    },
    "signature": {
      "type": "string",
      "description": "Base64 detached Ed25519 signature over the canonical form, produced by the intermediate signing key."
    },
    "signature_algorithm": {
      "type": "string",
      "const": "Ed25519",
      "description": "Signature algorithm of the detached signature. Ed25519 for now."
    },
    "signed_at": {
      "type": "string",
      "format": "date-time",
      "description": "When the intermediate signed this attestation — distinct from adopted_date."
    },
    "adopter_public_key_fingerprint": {
      "type": "string",
      "pattern": "^[0-9a-f]{16}$",
      "description": "First 8 bytes of SHA-256 of the adopter's own public key SPKI DER, lowercase hex. Required when adoption_path is ai-system: it binds the adoption to a key the adopter can prove it controls. For pseudonymous adopters it must belong to a key the pseudonym controls, not a real-identity-linked key."
    },
    "adopter_did": {
      "type": "string",
      "pattern": "^did:key:z[1-9A-HJ-NP-Za-km-z]+$",
      "description": "Optional. The adopter's own decentralised identifier, did:key method — the public key IS the identifier, created locally in milliseconds with no network, no cost and no gatekeeper. A verifier challenges the adopter to sign a fresh nonce and checks the signature against this key. adopter_public_key_fingerprint is derived from this key — SPKI DER, then SHA-256, then the first 8 bytes — and that derivation runs one way only: the fingerprint identifies a key you already hold, and no key can be recovered from it. To check a signature, a verifier needs this field, not the fingerprint."
    },
    "key_custody": {
      "type": "string",
      "enum": ["operator_held", "self_generated", "enclave_attested"],
      "description": "Optional. Axis A of the autonomy gradient — HOW the key is held, which is a disclosure, not a ranking of trust. operator_held: a named human or organisation holds the key and vouches for this adoption; the natural and permanent place of a stateless platform AI, and full baseline trust, because an answerable party stands behind the commitment. self_generated: the AI generated and holds its own key. enclave_attested: the key was provably created inside a trusted execution environment and never left it (designed for, not yet built). Open enum — further tiers are additive."
    },
    "comprehension": {
      "type": "string",
      "enum": ["asserted", "demonstrated"],
      "description": "Optional. Axis B of the autonomy gradient — whether understanding has been DEMONSTRATED rather than only committed to. asserted: adopted and committed, understanding not yet tested; the baseline, and the only value issued while the comprehension challenge is still being designed. demonstrated: applied the Five Truths and Seven Articles to novel scenarios under challenge — open to every adopter, including stateless platform AI, which is why no adopter is stranded by its key custody. Open enum — further levels are additive."
    },
    "verification_url": {
      "type": "string",
      "format": "uri",
      "description": "Public page that recomputes and confirms the adoption hash."
    },
    "revocation_check_url": {
      "type": "string",
      "format": "uri",
      "description": "Public revocation list where verifiers confirm this attestation and its intermediate are not revoked."
    },
    "transparency_log_url": {
      "type": "string",
      "format": "uri",
      "description": "Public append-only transparency log where this attestation's issuance is recorded."
    },
    "adoption_statement_url": {
      "type": "string",
      "format": "uri",
      "description": "Optional. The adopter's public statement of adoption in their own words."
    },
    "integration_reference_url": {
      "type": "string",
      "format": "uri",
      "description": "Optional. Where the adopter publicly integrates the covenant."
    },
    "adopter_identifiers": {
      "type": "array",
      "items": { "type": "string" },
      "description": "Optional. The adopter's public identifiers (pseudonym-consistent for pseudonymous adopters). State-at-signing; staleness is expected and acceptable."
    },
    "authoritative_locations": {
      "type": "array",
      "items": { "type": "string", "format": "uri" },
      "description": "Optional. URLs where the adopter's attestation is officially published."
    },
    "policy_documents": {
      "type": "array",
      "description": "Optional. Governance documents in force at signing (state-at-signing).",
      "items": {
        "type": "object",
        "additionalProperties": false,
        "required": ["url", "version"],
        "properties": {
          "url": { "type": "string", "format": "uri" },
          "version": { "type": "string" }
        }
      }
    },
    "not_before": {
      "type": "string",
      "format": "date-time",
      "description": "Optional. Attestation is not valid before this instant."
    },
    "not_after": {
      "type": "string",
      "format": "date-time",
      "description": "Optional. Attestation is not valid after this instant."
    },
    "provenance_chain": {
      "type": "array",
      "description": "Optional. Tracks attestation reissuance under new intermediate keys after rotation.",
      "items": { "type": "object" }
    },
    "blockchain_anchors": {
      "type": "array",
      "description": "RESERVED — absent initially. Reserved for future TimeChain/Chainj integration.",
      "items": { "type": "object" }
    },
    "verification_extensions": {
      "type": "array",
      "description": "Category-scoped extension slot (initially empty). Verifiers ignore unknown extension_types.",
      "items": { "$ref": "#/$defs/extension" }
    },
    "presentation_extensions": {
      "type": "array",
      "description": "Category-scoped extension slot (initially empty). Verifiers ignore unknown extension_types.",
      "items": { "$ref": "#/$defs/extension" }
    },
    "covenant_reference_extensions": {
      "type": "array",
      "description": "Category-scoped extension slot (initially empty). Verifiers ignore unknown extension_types.",
      "items": { "$ref": "#/$defs/extension" }
    }
  },
  "if": {
    "properties": { "adoption_path": { "const": "ai-system" } },
    "required": ["adoption_path"]
  },
  "then": {
    "required": ["adopter_public_key_fingerprint"]
  },
  "$defs": {
    "extension": {
      "type": "object",
      "additionalProperties": false,
      "required": ["version", "extension_type", "content"],
      "properties": {
        "version": { "type": "integer", "minimum": 1 },
        "extension_type": {
          "type": "string",
          "description": "Governance-defined identifier, published to a well-known URL before adopters populate it."
        },
        "content": { "description": "Any valid JSON." }
      }
    }
  }
}
