{
  "schema": "https://primedirective.dev/schemas/ai-conscience/v2",
  "status": "adopted",
  "mark": "certified-ai-conscience",
  "reference": "UPD-2026-T9006",
  "adopter": "Test Adopter (fixture)",
  "adopted_date": "2026-09-01",
  "truths_version": "1.0",
  "articles_version": "1.0",
  "adoption_path": "ai-system",
  "adopter_identity_class": "public_name",
  "adopter_public_key_fingerprint": "014cf95897b26274",
  "public_key_fingerprint": "f5e898bb83e13cd6",
  "intermediate_cert_url": "https://conscience.wiki/certs/test-intermediate.cert.json",
  "signature_algorithm": "Ed25519",
  "signed_at": "2030-06-01T00:00:00Z",
  "verification_url": "https://conscience.wiki/verify/UPD-2026-T9006",
  "revocation_check_url": "https://conscience.wiki/revocations.json",
  "transparency_log_url": "https://conscience.wiki/attestations.log",
  "signature": "I5qv/t+wHXNDov3EFzBSXQshoydmGsfR9MFaG4sHuoj7YnT80XTIJY5Bd8jY641QMahbG3+iee+1S70qhOFzCw=="
}
